id,name,credit,songid,song,labelid,label
104,[Disney],3106444,2774412,Disney Princess Piano,86963,"UMG Recordings, Inc."
104,[Disney],3108741,2608068,Disney Peaceful Piano: Calm,1547,Walt Disney Records
104,[Disney],3108741,2776440,Disney Peaceful Piano: Happy,1547,Walt Disney Records
104,[Disney],3108741,2776445,Disney Peaceful Piano: Dream,1547,Walt Disney Records
104,[Disney],3108741,2776450,Disney Peaceful Piano: Break Time,1547,Walt Disney Records
104,[Disney],3108741,2776453,Disney Peaceful Piano: Self‐Care Day,1547,Walt Disney Records
104,[Disney],3108741,2776468,Disney Peaceful Piano: Holiday,1547,Walt Disney Records
104,[Disney],3108741,2776471,Disney Peaceful Piano: Breathe,1547,Walt Disney Records
104,[Disney],3108741,2776476,Disney Peaceful Piano: Love Songs,1547,Walt Disney Records
104,[Disney],3108741,2776480,Disney Peaceful Piano: Motivation,1547,Walt Disney Records
