id,name,credit,songid,song,labelid,label
1513921,Marion Chesney,2007260,1810810,Agatha Raisin and the Haunted House,140,BBC Audiobooks
76203,Terry Pratchett,2088048,1869432,Mrs Bradshaw’s Handbook (To Travelling Upon the Ankh‐Morpork and Sto Plains Hygienic Railway),40359,ISIS
1139055,Michael Fenton Stevens,2088048,1869432,Mrs Bradshaw’s Handbook (To Travelling Upon the Ankh‐Morpork and Sto Plains Hygienic Railway),40359,ISIS
1513921,Marion Chesney,2731861,2409070,Agatha Raisin,81160,BBC Radio 4
1513921,Marion Chesney,2822676,2495483,Agatha Raisin: The Wizard of Evesham / The Murderous Marriage,140,BBC Audiobooks
