id,name,credit,songid,song,labelid,label
700479,Boston Modern Orchestra Project,2406695,2148517,Concertos for String Instruments,55199,BMOP/sound
700480,Gil Rose,2406695,2148517,Concertos for String Instruments,55199,BMOP/sound
1260273,Carter Enyeart,1513661,1551204,Suite for Cello and Chamber Winds / KC Capriccio / Woodwind Quintet / Feng / Tu,198,Naxos
1260276,The Lubbock Chorale,1513661,1551204,Suite for Cello and Chamber Winds / KC Capriccio / Woodwind Quintet / Feng / Tu,198,Naxos
1260278,Texas Tech Symphonic Wind Ensemble,1513661,1551204,Suite for Cello and Chamber Winds / KC Capriccio / Woodwind Quintet / Feng / Tu,198,Naxos
1260279,Sarah McKoin,1513661,1551204,Suite for Cello and Chamber Winds / KC Capriccio / Woodwind Quintet / Feng / Tu,198,Naxos
33262,Third Angle New Music Ensemble,2103545,1880155,Sound of the Five,9086,New World Records
