id,name,credit,songid,song,labelid,label
1777209,Lake City Stompers,2366210,2108413,Dixie Party 30x Old Time Jazz,42472,Elite Special
1130122,Black Bottom Stompers,2366210,2108413,Dixie Party 30x Old Time Jazz,42472,Elite Special
308708,Orchester der Wiener Staatsoper,2385972,2127323,Ouverture Zu Orpheus In Der Unterwelt / Bugle Boy March,170779,Boehm-Druck
744157,Josef Drexler,2385972,2127323,Ouverture Zu Orpheus In Der Unterwelt / Bugle Boy March,170779,Boehm-Druck
1541119,Dave Lee,2385975,2127324,The Pearls,42472,Elite Special
651097,Beryl Bryden,2385978,2127329,Down Yonder in New Orleans,42472,Elite Special
651097,Beryl Bryden,2939342,2617023,Ace in the Hole / Way Down Yonder in New Orleans,42472,Elite Special
651097,Beryl Bryden,2939342,2617023,Ace in the Hole / Way Down Yonder in New Orleans,42472,Elite Special
