id,name,credit,songid,song,labelid,label
770239,Orquesta de la Comunidad de Madrid,2274689,1124109,Preludes and Choruses from Zarzuelas,198,Naxos
720066,Coro de la Comunidad de Madrid,2274689,1124109,Preludes and Choruses from Zarzuelas,198,Naxos
531265,Manuel Penella Moreno,2275281,2026611,El Gato Montés,743,Deutsche Grammophon
130379,Orquesta sinfónica de Madrid,2275281,2026611,El Gato Montés,743,Deutsche Grammophon
403499,Tomás Bretón,2487417,1121443,Andalusian Scenes / In the Alhambra / Opera Preludes,198,Naxos
770239,Orquesta de la Comunidad de Madrid,2487417,1121443,Andalusian Scenes / In the Alhambra / Opera Preludes,198,Naxos
