id,name,credit,songid,song,labelid,label
123394,Jim Eanes,2371553,2116658,Jim Eanes with Red Smiley and The Blue Grass Cut-Ups,31960,Rural Rhythm Records
123394,Jim Eanes,2371553,2116658,Jim Eanes with Red Smiley and The Blue Grass Cut-Ups,31960,Rural Rhythm Records
534888,J.E. Mainer,2587200,2291529,The Legendary J.E. Mainer: Vol. 3,31960,Rural Rhythm Records
534888,J.E. Mainer,2587200,2291529,The Legendary J.E. Mainer: Vol. 3,31960,Rural Rhythm Records
1275660,"Clarence ""Tater"" Tate",2604713,2303447,Fiddling Favorites Of U.S.A And Canada,31960,Rural Rhythm Records
