id,name,credit,songid,song,labelid,label
184608,Acid Mothers Temple & The Melting Paraiso U.F.O.,2696383,2376855,Chosen Star Child's Confession,20081,Riot Season
184608,Acid Mothers Temple & The Melting Paraiso U.F.O.,2696383,2376855,Chosen Star Child's Confession,20081,Riot Season
184608,Acid Mothers Temple & The Melting Paraiso U.F.O.,2696383,2376855,Chosen Star Child's Confession,20081,Riot Season
184608,Acid Mothers Temple & The Melting Paraiso U.F.O.,2696383,2648510,Reverse of Rebirth Reprise,96101,Nod and Smile Records
1563065,Yumi Hara Cawkwell,2548801,2265691,Upstream,-1,
1007571,Frank Wuyts,2928810,2605013,From Here To Drums,38228,No Man’s Land
118269,河端一,3052286,2724482,Villa K,3267,[no label]
118269,河端一,3052286,2724482,Villa K,3267,[no label]
