id,name,credit,songid,song,labelid,label
1967235,Shahram Golparian,2689230,2371130,Shekoofeh Dar Shekoofhe (Blossoms),127470,Hamavaz Ahang
1967235,Shahram Golparian,2689230,2371137,Shokoofehe Khaterat (Jane Maryam),127470,Hamavaz Ahang
1967235,Shahram Golparian,2689230,2371037,Dar Mahe Baran (In The Season of Rain),127470,Hamavaz Ahang
365721,Fariborz Lachini,2689326,2371124,Songs of the Sun Land,122130,Neydavoud Records
1952900,Ahmadreza Ahmadi,2662317,2347772,In a Cold Winter Night (Dar Shabe Sarde Zemestani): Nima Youshij Poems,28363,Lachini Media
365721,Fariborz Lachini,2662317,2347772,In a Cold Winter Night (Dar Shabe Sarde Zemestani): Nima Youshij Poems,28363,Lachini Media
1967231,Mohammad Sarir,2689218,2371027,Cheraghi dar Ofogh (A Light in the Horizon),193027,Souroush Media
1967231,Mohammad Sarir,2689218,2371043,The Most Delightful (Delaviztarin),122130,Neydavoud Records
1967231,Mohammad Sarir,2689218,2371062,Everlasting Airs (Jelvehaye Mandegar),122130,Neydavoud Records
