id,name,credit,songid,song,labelid,label
47956,Buck Clayton,1027854,627304,Jazz in Paris: Club Session,6085,Gitanes Jazz Productions
669523,Charlie Singleton,1027854,627304,Jazz in Paris: Club Session,6085,Gitanes Jazz Productions
199731,Charlie Barnet and His Orchestra,2159673,1924315,Skyliner 1940-1945,1608,Giants of Jazz
21791,Lena Horne,2159673,1924315,Skyliner 1940-1945,1608,Giants of Jazz
4216,Kay Starr,2159673,1924315,Skyliner 1940-1945,1608,Giants of Jazz
901285,Buck Clayton and His All-Stars,2367175,2109558,"Club Session / 1st, Club Session / 2nd",140988,Le Club français du disque
