id,name,credit,songid,song,labelid,label
1023985,John Cunliffe,1190267,1282730,More Postman Pat Stories,81382,Collins Audio
1187634,Carole Boyd,1764601,1729414,Postman Pat and the Tuba & Pat and the Barometer,140,BBC Audiobooks
1954696,Charlie Chalk,2665726,2351015,Songs and Music From the TV Series,191500,Redrock Music
638262,Joan Baxter,2665726,2351015,Songs and Music From the TV Series,191500,Redrock Music
657103,Mike Redway,2665726,2351015,Songs and Music From the TV Series,191500,Redrock Music
