id,name,credit,songid,song,labelid,label
4523,Sidney Bechet,2216104,1969901,Souvenirs de La Nouvelle Orleans,3653,Disques Vogue
3449,Teddy Buckner,2216104,1969901,Souvenirs de La Nouvelle Orleans,3653,Disques Vogue
561845,Joe Darensbourg,2216104,1969901,Souvenirs de La Nouvelle Orleans,3653,Disques Vogue
4626,Bix Beiderbecke,2417325,157228,Jazz Lips,-1,
4626,Bix Beiderbecke,2417325,157228,Jazz Lips,17546,History
607033,Kid Oryʼs Creole Jazz Band,2446781,2184240,"At the Green Room, Volume 2",38689,American Music
121488,Henry “Red” Allen,2930269,2606923,Red Allen Meets Kid Ory,2033,Verve
