id,name,credit,songid,song,labelid,label
471961,Ottilie Patterson,1556182,868657,The Classic Concerts 1959/1961,39607,The Chris Barber Collection
51413,Kenny Ball & His Jazzmen,1613055,1624653,"The Best of Ball, Barber & Bilk",109939,Pye Golden Guinea Records
193819,Mr. Acker Bilk and His Paramount Jazz Band,1613055,1624653,"The Best of Ball, Barber & Bilk",109939,Pye Golden Guinea Records
51413,Kenny Ball & His Jazzmen,2283156,868634,The Ultimate!,20469,Kaz Records
193819,Mr. Acker Bilk and His Paramount Jazz Band,2283156,868634,The Ultimate!,20469,Kaz Records
355316,Chris Barber,2336274,2083728,The Outstanding Album,10373,Audiophile
312674,Großes Rundfunkorchester Berlin,2342596,868664,New Orleans Symphony,9518,Zounds
471961,Ottilie Patterson,3099069,2768536,Chris Barbers’s Blues Book Volume One/Good Mornin’,6501,Beat Goes On Records
