id,name,credit,songid,song,labelid,label
39112,Silver Apples,809862,330875,A Lake of Teardrops,4533,Space Age Recordings
39112,Silver Apples,809862,330875,A Lake of Teardrops,4533,Space Age Recordings
55248,Jessamine,812060,63481,A Pox on You,4533,Space Age Recordings
8136,Sonic Boom,999664,15256,What Came Before After,521,Sympathy for the Record Industry
1340,Stereolab,2414356,2155772,Soul Kiss Glide Divine / Tone Burst / Tempter,1561,Silvertone Records
42213,Spacemen 3,1670327,1666969,Split 7″,30560,The Great Pop Supplement
292299,MGMT,1670327,1666969,Split 7″,30560,The Great Pop Supplement
437887,The Imajinary Friends,1800947,1736544,Interface/Come Out To Play,4533,Space Age Recordings
