id,name,credit,songid,song,labelid,label
2327,Johann Sebastian Bach,1490503,934523,The Six Motets,1548,Carlton Classics
1240280,Yorkshire Bach Choir,1490503,934523,The Six Motets,1548,Carlton Classics
1240280,Yorkshire Bach Choir,1701781,1689062,Festal Mass at the Imperial Court of Vienna 1648,75686,Allegro
1397794,Yorkshire Baroque Soloists,1701781,1689062,Festal Mass at the Imperial Court of Vienna 1648,75686,Allegro
1366346,Baroque Brass of London,1701781,1689062,Festal Mass at the Imperial Court of Vienna 1648,75686,Allegro
