id,name,credit,songid,song,labelid,label
85233,José Carreras,813158,888154,A Celebration of Christmas,25,Elektra
23678,Plácido Domingo,813158,888154,A Celebration of Christmas,25,Elektra
31442,Johnny Mathis,875314,253164,Unforgettable: A Musical Tribute to Nat King Cole,235,Columbia
46320,Peabo Bryson,1124077,1238701,We're the Best of Friends,155,Capitol Records
30174,The Tabernacle Choir at Temple Square,1531081,1028775,The Most Wonderful Time of the Year,20227,Mormon Tabernacle Choir
14410,Nat King Cole,2043314,1764161,Unforgettable,862,Elektra Entertainment
14410,Nat King Cole,2043314,1764161,Unforgettable,862,Elektra Entertainment
12299,London Symphony Orchestra,2634950,429145,The Magic of Christmas,25,Elektra
