id,name,credit,songid,song,labelid,label
127891,Eoin Colfer,2022983,582139,Artemis Fowl: The Opal Deception,3617,Listening Library
127891,Eoin Colfer,2022983,581787,Artemis Fowl: The Arctic Incident,-1,
127891,Eoin Colfer,2022983,549048,Artemis Fowl: The Eternity Code,57514,Chivers Audio Books
127891,Eoin Colfer,2022983,1097881,Artemis Fowl: The Atlantis Complex,3617,Listening Library
127891,Eoin Colfer,2022983,545714,Artemis Fowl,-1,
127891,Eoin Colfer,2022983,677549,Artemis Fowl and the Lost Colony,3617,Listening Library
127891,Eoin Colfer,2022983,2610791,The Fowl Twins,-1,
