id,name,credit,songid,song,labelid,label
921439,Bodega Bamz,2512571,2239065,Bodega's Way,-1,
215252,Joell Ortiz,2436275,2174932,BoxTalk,-1,
1096735,Gallant,2382533,2124319,Roll the Dice,86601,Louder Than Life
581593,Terrace Martin,2617673,2311619,"Northside of Linden, Westside of Slauson",86601,Louder Than Life
984899,Kat Dahlia,2826850,1973923,South Beach Social Club,96659,Larger Than Life Records
984899,Kat Dahlia,2826850,1973923,South Beach Social Club,96659,Larger Than Life Records
53990,Black Thought,2904751,2066597,"Streams of Thought, Vol. 2",120308,Passyunk Productions
53990,Black Thought,2904751,2066597,"Streams of Thought, Vol. 2",143618,Human Re Sources
387104,Claudette Ortiz,3089822,2759754,All I Need Is You,86601,Louder Than Life
