id,name,credit,songid,song,labelid,label
133579,Chip Taylor,816580,88007,Let's Leave This Town,25963,Train Wreck Records
133579,Chip Taylor,816580,174930,The Trouble With Humans,25963,Train Wreck Records
133579,Chip Taylor,816580,174930,The Trouble With Humans,-1,
133579,Chip Taylor,816580,174930,The Trouble With Humans,-1,
133579,Chip Taylor,816580,383220,Red Dog Tracks,5655,Back Porch
133579,Chip Taylor,816580,884974,Live From the Ruhr Triennale,25963,Train Wreck Records
133579,Chip Taylor,816580,1991661,Angel of the Morning,25963,Train Wreck Records
133579,Chip Taylor,816580,2132849,The New Bye & Bye,25963,Train Wreck Records
1301750,Ben Kyle,1575886,1052021,We Still Love Our Country,56719,Ninth Street Opus
