id,name,credit,songid,song,labelid,label
784024,Gilles Tremblay,2146764,1040346,Les Vêpres de la Vierge,146134,Analekta Fleurs de Lys
1610600,Société de musique contemporaine du Québec,2146764,1040346,Les Vêpres de la Vierge,146134,Analekta Fleurs de Lys
1610601,Chœur de chambre de l’Orchestre symphonique de Montréal,2146764,1040346,Les Vêpres de la Vierge,146134,Analekta Fleurs de Lys
9290,Terry Riley,2291280,2040918,In C,3051,ATMA Classique
269358,Raôul Duguay,2291280,2040918,In C,3051,ATMA Classique
1610600,Société de musique contemporaine du Québec,2291280,2040918,In C,3051,ATMA Classique
