id,name,credit,songid,song,labelid,label
353187,David Nathan,2555050,2269677,Zorn: Tod und Regen,8867,Argon Hörbuch
353187,David Nathan,2555050,2269911,Zorn: Vom Lieben und Sterben,8867,Argon Hörbuch
353187,David Nathan,2555050,2269921,Zorn: Wo kein Licht,8867,Argon Hörbuch
353187,David Nathan,2555050,2269929,Zorn: Wie sie töten,8867,Argon Hörbuch
353187,David Nathan,2555050,2269938,Zorn: Kalter Rauch,8867,Argon Hörbuch
353187,David Nathan,2555050,2269941,Zorn: Wie du mir,112155,SAGA Egmont
353187,David Nathan,2555050,2269957,Zorn: Lodernder Hass,112155,SAGA Egmont
353187,David Nathan,2555050,2269973,Zorn: Blut und Strafe,112155,SAGA Egmont
353187,David Nathan,2555050,2269979,Zorn: Tod um Tod,38571,Audio Media
