id,name,credit,songid,song,labelid,label
147688,Anita Kerr,1998898,1804931,Wine In The Wind / Happiness,32970,Warner Bros.-Seven Arts Records
53135,Esther Phillips,2123580,1896588,Release Me! Reflections of Country and Western Greats,16999,Lenox
312,Chet Atkins,2287079,2038637,Nashville Stars on Tour - Live Recordings,2712,RCA Victor
73294,Bobby Bare,2287079,2038637,Nashville Stars on Tour - Live Recordings,2712,RCA Victor
35917,Jim Reeves,2287079,2038637,Nashville Stars on Tour - Live Recordings,2712,RCA Victor
