id,name,credit,songid,song,labelid,label
11669,Ludacris,878123,1898190,Dirt Road Anthem (remix),6620,Broken Bow Records
74202,Kelly Clarkson,955675,2361923,Don't You Wanna Stay,6620,Broken Bow Records
250553,Carrie Underwood,3054709,2726651,If I Didn't Love You,149465,"Macon Music, LLC"
250553,Carrie Underwood,3054709,2728011,If I Didn’t Love You,6620,Broken Bow Records
250553,Carrie Underwood,3054709,2728011,If I Didn’t Love You,149465,"Macon Music, LLC"
250553,Carrie Underwood,3054709,2728011,If I Didn’t Love You,20411,Capitol Records Nashville
