id,name,credit,songid,song,labelid,label
104810,Mary Roos,2660988,2346762,Es wird ja alles wieder gut,-1,
104810,Mary Roos,2660988,2346763,"Ja, das mit der Liebe",-1,
1746451,Paul Schröder,2677089,2360942,Zwischen drei und vier,782,AMIGA
120821,Helga Brauer,2677089,2360942,Zwischen drei und vier,782,AMIGA
112613,Nini Rosso,2882126,2554371,La Montanara,170749,Opera
66192,Peter Alexander,2882126,2554371,La Montanara,170749,Opera
104814,Marion Maerz,2882126,2554371,La Montanara,170749,Opera
379742,Werner Müller und sein Orchester,2816375,2489976,Grüsse aus Kiel,202921,Lebendiges Kiel
