id,name,credit,songid,song,labelid,label
1795252,"Blasorchester ""Großer Kurfürst""",2429199,2169094,Band Marches of Europe,15857,Polydor
1825366,Royal Military Band,2429199,2169094,Band Marches of Europe,15857,Polydor
1825368,Hans Freese and His Military Band,2429199,2169094,Band Marches of Europe,15857,Polydor
1085612,Norbert Nozy,2833347,2504800,Flanders Music for Harmony Orchestra,184962,René Gailly International Productions
9716,Richard Strauss,2833353,1412615,Don Juan / Till Eulenspiegel / Tod und Verklärung,184962,René Gailly International Productions
1085612,Norbert Nozy,2833353,1412615,Don Juan / Till Eulenspiegel / Tod und Verklärung,184962,René Gailly International Productions
