id,name,credit,songid,song,labelid,label
808705,The Old Firm Casuals,1287588,1355174,Oi! Rules... OK!,46633,Randale Records
418979,Frankie Flame,2133851,848952,The Way We Feel,46633,Randale Records
418979,Frankie Flame,2133851,2591206,The Way We Feel,46633,Randale Records
2114042,Bouncing Soles,2916386,2591207,Pull on Your Boots,5057,Black Butcher Records
51975,The 4‐Skins,2916387,2591208,Turning the Past Into the Present,46633,Randale Records
561266,Gimp Fist,2916390,2591210,That Old Tattoo / Pick Up the Pieces,46633,Randale Records
669983,Marching Orders,2916391,2591211,Yesterday's Rebellion / Worth the Fight,46633,Randale Records
808705,The Old Firm Casuals,2916394,2591212,Yuletide Cheers & Oi!,46633,Randale Records
