id,name,credit,songid,song,labelid,label
1364856,CNCO,1978249,1788936,Princesa,-1,
193907,Fonseca,2096992,1876589,Caminar de tu mano (club remix),235,Columbia
193907,Fonseca,2096992,1876593,Caminar de tu mano,235,Columbia
286760,Yuridia,2852139,2523990,Yo te prefiero a ti (versión banda),117974,RCA Records Label
1147225,La Adictiva Banda San José de Mesillas,2852139,2523990,Yo te prefiero a ti (versión banda),117974,RCA Records Label
116401,Thalía,3019315,2694922,Lo siento mucho (versión mariachi),5662,Sony Music
