id,name,credit,songid,song,labelid,label
1760334,"Choir of All Saints Church, Margaret Street",2367926,2110456,Christmas Collection 2010,27573,CRS Records
1269057,Liverpool Cathedral Choir,2367926,2110456,Christmas Collection 2010,27573,CRS Records
417169,Lincoln Cathedral Choir,2367926,2110456,Christmas Collection 2010,27573,CRS Records
1049219,Terence Duffy,2549990,1307312,Music from Midnight Mass at Liverpool Metropolitan Cathedral,67137,Herald
1404347,Richard Lea,2549990,1307312,Music from Midnight Mass at Liverpool Metropolitan Cathedral,67137,Herald
