id,name,credit,songid,song,labelid,label
169887,氷上恭子,808134,248948,C.H.O.C.O.,5626,avex mode
169887,氷上恭子,808134,248946,あなたに逢いたくて 〜Missing You〜 (Millennium Dance version),5626,avex mode
169887,氷上恭子,808134,248946,あなたに逢いたくて 〜Missing You〜 (Millennium Dance version),-1,
1445567,カリオストロ,1807184,1737642,7日間かけて世界を創るより可愛い女の子1人創った方がいい 〜GRANBLUE FANTASY〜,3247,Aniplex
493263,木之本桜,2141786,1910514,カードキャプターさくら Character Single SAKURA,888,Victor
66503,梶浦由記,2749376,2153017,ソードアート・オンライン アリシゼーション 4 特典CD: Symphonic Alicization Orchestra #4 & Original Soundtrack Alicization vol.1,3247,Aniplex
1882956,カーディナル,2749376,2153017,ソードアート・オンライン アリシゼーション 4 特典CD: Symphonic Alicization Orchestra #4 & Original Soundtrack Alicization vol.1,3247,Aniplex
