id,name,credit,songid,song,labelid,label
2064980,Gloriam Draconis,2839259,2510662,Amalgamation of the Opposites,3267,[no label]
1587995,Xenotaph,2839259,2510662,Amalgamation of the Opposites,3267,[no label]
1756790,Ehecatl,2839259,2510662,Amalgamation of the Opposites,3267,[no label]
1640943,Thoabath,2839277,2510669,Palace of Worms / Thoabath,21729,King of the Monsters
850362,Botanist,1285384,1353438,EP I: The Hanging Gardens of Hell / Ode to Joy,51908,The Flenser
1193400,Mastery,1422443,1484532,Palace of Worms / Mastery,51908,The Flenser
1193400,Mastery,1422443,1484532,Palace of Worms / Mastery,51908,The Flenser
1193400,Mastery,1422443,1484532,Palace of Worms / Mastery,51908,The Flenser
1200927,Ecferus,2833522,2505414,Palace of Worms / Ecferus,102267,Crown and Throne Ltd.
