id,name,credit,songid,song,labelid,label
599495,Christoph Maria Herbst,1293216,1359702,Tafiti und die Reise ans Ende der Welt,9934,Der Hörverlag
599495,Christoph Maria Herbst,1293216,2080165,Tafiti und Ur-ur-ur-ur-ur-uropas Goldschatz,9934,Der Hörverlag
884004,Philipp Schepmann,2013603,2359674,Tafiti und der Honigfrechdachs,9934,Der Hörverlag
775913,Liane Schneider,2069656,1586052,Conni und das ganz spezielle Weihnachten,-1,
1313477,Wolf Frass,2526853,2249681,Conni und das tanzende Pony,37849,Universal Music Family Entertainment
1313477,Wolf Frass,2526853,2250637,Conni und der große Schnee,37849,Universal Music Family Entertainment
