id,name,credit,songid,song,labelid,label
1444814,morgxn,2838802,2510207,i hope you cry,10367,Sumerian Records
51876,Rise Against,3053550,2725528,Nowhere Generation (acoustic remix),78025,Loma Vista Recordings
51876,Rise Against,3053550,2725528,Nowhere Generation (acoustic remix),78025,Loma Vista Recordings
2080752,All the Damn Vampires,3105674,2773849,Breaks My Back (All the Damn Vampires remix),10367,Sumerian Records
2080752,All the Damn Vampires,3105674,2773849,Breaks My Back (All the Damn Vampires remix),10367,Sumerian Records
