id,name,credit,songid,song,labelid,label
437604,Eric Whitacre,2011192,757998,Brigham Young University Choirs and Eric Whitacre 2,-1,
528095,Brigham Young University Concert Choir,2011192,757998,Brigham Young University Choirs and Eric Whitacre 2,-1,
601942,Brigham Young University Women's Chorus,2011192,757998,Brigham Young University Choirs and Eric Whitacre 2,-1,
517210,Ronald Staheli,1690028,771442,I Believe This Is Jesus,24715,Tantara Records
437604,Eric Whitacre,1998094,104688,The Complete A Cappella Works: 1991-2001,23119,ARSIS Audio
517210,Ronald Staheli,1998094,104688,The Complete A Cappella Works: 1991-2001,23119,ARSIS Audio
