id,name,credit,songid,song,labelid,label
1333686,Gladys Rice,2296598,2047347,"Barcarolle ""Tales of Hoffman"" / All Through the Night",161874,Pathé Actuelle
354371,Lewis James,2296598,2047347,"Barcarolle ""Tales of Hoffman"" / All Through the Night",161874,Pathé Actuelle
1725216,George Wilton Ballard,2296609,2047359,Love's Old Sweet Song / Drink to Me Only With Thine Eyes,1566,Silvertone Records
1725232,Maria Cardinelli,2296642,2047366,I Love You Truly / Oh Promise Me,161883,Globe
1725232,Maria Cardinelli,2296642,2047366,I Love You Truly / Oh Promise Me,161886,Hytone Phonograph Record
