id,name,credit,songid,song,labelid,label
41963,Jim Lauderdale,2605717,2472589,Loves Gonna Live Here,2101,Time-Life Music
46864,Lee Greenwood,2796176,2472509,Back To Back: Lee Greenwood & Tanya Tucker,201355,Westmill
1607,Dolly Parton,2796278,2472616,Back to Back: Dolly Parton & Tanya Tucker,44911,One Media Publishing Ltd.
2164989,LaCosta Tucker,3000525,2679413,Sisters: An Anthology,62793,EMI
2164989,LaCosta Tucker,3000525,2679413,Sisters: An Anthology,171207,Renaissance Records
34318,RuPaul,3093773,2763489,This is Our Country,90147,World of Wonder
