id,name,credit,songid,song,labelid,label
601124,Orquestra Sinfônica Nacional da Rádio MEC,1715901,735146,Canticum Naturale,-1,
1408993,Orquestra de Camara da Rádio MEC,1715901,735146,Canticum Naturale,-1,
1409227,Camerata Florianópolis,1715912,756481,Edino Krieger,-1,
1409228,Jefferson Della Rocca,1715912,756481,Edino Krieger,-1,
1409208,Orquestra de Câmara Villa-Lobos,1715920,756479,Edino Krieger,-1,
24514,Михаил Иванович Глинка,2060076,1849117,Festival Internacional de Inverno de Campos do Jordão,413,Biscoito Fino
122653,Пётр Ильич Чайковский,2060076,1849117,Festival Internacional de Inverno de Campos do Jordão,413,Biscoito Fino
731590,Roberto Minczuk,2060076,1849117,Festival Internacional de Inverno de Campos do Jordão,413,Biscoito Fino
1392425,Orquestra Acadêmica do Festival Internacional de Inverno de Campos Do Jordão,2060076,1849117,Festival Internacional de Inverno de Campos do Jordão,413,Biscoito Fino
