id,name,credit,songid,song,labelid,label
2327,Johann Sebastian Bach,1397997,1096164,5 Piano Concertos,60630,PIANO 21
267016,Κυπριανός Κατσαρής,1397997,1096164,5 Piano Concertos,60630,PIANO 21
1174772,Chamber Orchestra of the Festival of Echternach,1397997,1096164,5 Piano Concertos,60630,PIANO 21
169078,Carl Philipp Emanuel Bach,2594435,510980,"C. P. E. Bach: Sinfonias, Wq. 183, Nos. 1-4 / W. F. Bach: Sinfonia in F major",198,Naxos
118257,Wilhelm Friedemann Bach,2594435,510980,"C. P. E. Bach: Sinfonias, Wq. 183, Nos. 1-4 / W. F. Bach: Sinfonia in F major",198,Naxos
979899,Salzburger Kammerorchester,2594435,510980,"C. P. E. Bach: Sinfonias, Wq. 183, Nos. 1-4 / W. F. Bach: Sinfonia in F major",198,Naxos
