id,name,credit,songid,song,labelid,label
196832,Mac Dre,826136,834174,A Tale of Two Andres,17187,Thizz Entertainment
196832,Mac Dre,826136,834174,A Tale of Two Andres,148790,Tommy Gun Ent.
196832,Mac Dre,1123737,1238298,Tales of II Andre's,17187,Thizz Entertainment
137935,Equipto,1123738,144189,Midnight Machine Gun Rhymes and Alibis,92019,Soul Note Records
137935,Equipto,1123738,410265,Horns and Halos,61063,Million Dollar Dream
137935,Equipto,1123738,515362,Bullet Symphony: Horns And Halos #3,89269,Fillmoe Coleman Records
828485,Problem,1509208,1469397,Jelly,-1,
