id,name,credit,songid,song,labelid,label
775693,Olivier Durand,858053,2409673,Soul Surfing: The Next Wave,2864,Last Call Records
775693,Olivier Durand,858053,1094642,Murphy Gets Muddy,2864,Last Call Records
30721,Iain Matthews,869608,330783,La Terre Commune,14433,Coast to Coast
2388,Nas,870279,705440,"2007-05-25: Sala Pasternak, Vic, Spain",-1,
30721,Iain Matthews,1495833,1538817,"Official Blue Rose Bootleg Series - Elliott Murphy, Iain Matthews & Olivier Durands - Solingen 2001",16700,Blue Rose Records
775693,Olivier Durand,1495833,1538817,"Official Blue Rose Bootleg Series - Elliott Murphy, Iain Matthews & Olivier Durands - Solingen 2001",16700,Blue Rose Records
1993042,The Normandy All Stars,2890904,2563152,Just A Story From New York,2864,Last Call Records
775693,Olivier Durand,2890904,2563152,Just A Story From New York,2864,Last Call Records
