id,name,credit,songid,song,labelid,label
837209,The Deuces of Rhythm,2112579,1110147,Ain't That Good News / Fool at the Wheel,30242,Peacock Records
837209,The Deuces of Rhythm,2112579,1110147,Ain't That Good News / Fool at the Wheel,30242,Peacock Records
3331,Little Richard,2112579,1110147,Ain't That Good News / Fool at the Wheel,30242,Peacock Records
3331,Little Richard,2112579,1110147,Ain't That Good News / Fool at the Wheel,30242,Peacock Records
3331,Little Richard,2112653,1110148,"Always / Rice, Red Beans and Turnip Greens",30242,Peacock Records
