id,name,credit,songid,song,labelid,label
34491,Felix Mendelssohn,2170846,1934473,Complete Works for Cello & Piano,222456,Koch Discover International
1227908,James Kreger,2170846,1934473,Complete Works for Cello & Piano,222456,Koch Discover International
681458,Henry Litolff,2759915,2298143,"Concerto Symphonique no. 4 in D minor, op. 102",187293,Genesis
404723,Orchestre Philharmonique de Monte‐Carlo,2759915,2298143,"Concerto Symphonique no. 4 in D minor, op. 102",187293,Genesis
734231,Edouard van Remoortel,2759915,2298143,"Concerto Symphonique no. 4 in D minor, op. 102",187293,Genesis
