id,name,credit,songid,song,labelid,label
132695,Jorge Negrete,840316,1120580,Jorge Negrete y Pedro Infante: 30 éxitos,7043,Orfeón
132695,Jorge Negrete,2403269,2145188,Los tres grandes de México,7043,Orfeón
23514,Vicente Fernández,2403269,2145188,Los tres grandes de México,7043,Orfeón
895986,Germán Lizárraga y su Banda Estrellas de Sinaloa,994167,1133898,Pedro Infante con la Banda Estrellas de Sinaloa de Germán Lizárraga,6779,Warner Music México
216565,Manuel Mijares,994177,1114225,Querido amigo,62793,EMI
69886,Lola Beltrán,2715686,2393874,"Lola Beltrán y Pedro Infante cantan a México, vol. 2",95037,ECO
