id,name,credit,songid,song,labelid,label
9064,Darude,895974,990396,I Ran (So Far Away),5094,HMC
9064,Darude,895974,990396,I Ran (So Far Away),1275,Robbins
503994,Daniel Wanrooy,1161852,1301473,Stay In The Moment,1489,Black Hole Recordings
503994,Daniel Wanrooy,1161852,1301473,Stay In The Moment,1489,Black Hole Recordings
65371,Robbie Rivera,1348721,1903585,Heartbreak On Vinyl (The Robbie Rivera Remixes),15037,Tommy Boy Entertainment
1129832,Postmodern Jukebox,1619074,1986800,The Middle,71095,Mud Hut
