id,name,credit,songid,song,labelid,label
134370,Cedric Gervais,2050503,1842495,Somebody New,62,Island
134370,Cedric Gervais,2050503,1842915,Somebody New (Just Kiddin remix),62,Island
134370,Cedric Gervais,2050503,1842908,Somebody New (acoustic version),62,Island
134370,Cedric Gervais,2934388,1842923,Somebody New (Cedric Gervais vs Laurent Simeca remix),62,Island
134370,Cedric Gervais,2934388,1842899,Somebody New (Somebody dub),62,Island
134370,Cedric Gervais,2934388,1842911,Somebody New (HEDEGAARD remix),62,Island
