id,name,credit,songid,song,labelid,label
226527,Eugène Ysaÿe,1619509,1629689,"Six Sonatas for Solo Violin, op. 27",36314,Decca Classics
490318,Gian Francesco Malipiero,2334888,2082643,Violin Concertos,1546,Sony Classical
147664,Ferruccio Busoni,2334888,2082643,Violin Concertos,1546,Sony Classical
520898,Orchestra Sinfonica di Milano Giuseppe Verdi,2334888,2082643,Violin Concertos,1546,Sony Classical
1703956,Tito Ceccherini,2334888,2082643,Violin Concertos,1546,Sony Classical
34491,Felix Mendelssohn,2564382,2129505,"Concerto per violino e orchestra d’archi / Concerto per violino, pianoforte e orchestra d’archi",10516,Amadeus
1079566,Roberto Prosseda,2564382,2129505,"Concerto per violino e orchestra d’archi / Concerto per violino, pianoforte e orchestra d’archi",10516,Amadeus
512009,Orchestra di Padova e del Veneto,2564382,2129505,"Concerto per violino e orchestra d’archi / Concerto per violino, pianoforte e orchestra d’archi",10516,Amadeus
1793650,Pier Carlo Orizio,2564382,2129505,"Concerto per violino e orchestra d’archi / Concerto per violino, pianoforte e orchestra d’archi",10516,Amadeus
