id,name,credit,songid,song,labelid,label
1103980,Célimène Daudet,1467190,1363600,Dans la malle du Poilu,59198,Arion
23395,Игорь Фёдорович Стравинский,2887708,2559702,Stravinsky: Concerto in D major / Corigliano: The Red Violin Concerto,96246,NoMadMusic
119192,John Corigliano,2887708,2559702,Stravinsky: Concerto in D major / Corigliano: The Red Violin Concerto,96246,NoMadMusic
788882,Orchestre Philharmonique Royal de Liège,2887708,2559702,Stravinsky: Concerto in D major / Corigliano: The Red Violin Concerto,96246,NoMadMusic
1806120,Adrien Perruchon,2887708,2559702,Stravinsky: Concerto in D major / Corigliano: The Red Violin Concerto,96246,NoMadMusic
