id,name,credit,songid,song,labelid,label
1021,Ludwig van Beethoven,1143498,1253490,"The Complete Quartets, Volume V",3024,Delos
46612,Ofra Harnoy,1531731,251912,Beatles by 5,3478,Pro-Arte Records
10211,Maurice Ravel,2049049,1841376,String Quartets,426,London Records
10341,Claude Debussy,2049049,1841376,String Quartets,426,London Records
1021,Ludwig van Beethoven,2044156,1828434,"The Complete Quartets, Volume VIII",3024,Delos
1021,Ludwig van Beethoven,2030054,1828427,"The Complete Quartets, Volume VII",3024,Delos
1021,Ludwig van Beethoven,2030054,1828420,Beethoven: The Complete Quartets Volume III,3024,Delos
11285,Wolfgang Amadeus Mozart,2064074,1852733,String Quartets: G major K. 387 / D minor K. 421 / B-flat major K. 458 / C major K. 465,25621,DOREMI
