id,name,credit,songid,song,labelid,label
1311000,Mark Cosgrove,2254675,2006381,Regions of the Soul,157900,Strictly Music
1863591,Nugget,2490377,2220907,Live At The European World Of Bluegrass,23333,Strictly Country
68581,Chris Jones,2490444,2220985,Blue Lonesome Wind (Live in Holland),23333,Strictly Country
212651,Good Ol' Persons,2945494,2624313,Live In Holland Volume 4,23333,Strictly Country
1692807,Whetstone Run,2945494,2624313,Live In Holland Volume 4,23333,Strictly Country
326952,High Country,2945494,2624313,Live In Holland Volume 4,23333,Strictly Country
