id,name,credit,songid,song,labelid,label
217695,K.A.B.,1659854,1660002,Join the Minikab,119451,Feed Me Records
217695,K.A.B.,1659854,1660003,Feedback,119453,Size Doesn't Matter Recordings
414873,Sebastian Mullaert,1752552,1724976,WaWuWe,4243,Mule Electronic
217695,K.A.B.,2111128,940552,That’s a Nice Way to Give Me Feedback (remixes),46069,Audiobahn
217695,K.A.B.,2111128,940552,That’s a Nice Way to Give Me Feedback (remixes),168022,Bond Records
217695,K.A.B.,2111128,1887518,That’s a Nice Way EP,46069,Audiobahn
