id,name,credit,songid,song,labelid,label
1519951,Gil Evans Paris Workshop,2015350,1816668,Spoonful,105348,jazz&people
46088,Gil Evans,2267595,2019186,Golden Hair,-1,
46088,Gil Evans,2267595,2019186,Golden Hair,1959,EmArcy
448233,Laurent Cugny Big Band Lumière,2267595,2019186,Golden Hair,-1,
448233,Laurent Cugny Big Band Lumière,2267595,2019186,Golden Hair,1959,EmArcy
393242,Orchestre National de Jazz,3001234,2679948,Yesternow,2033,Verve
393242,Orchestre National de Jazz,3001234,2679948,Yesternow,2033,Verve
