id,name,credit,songid,song,labelid,label
3416,Billie Holiday,2156676,1921847,New Orleans Original Film Soundtrack,7414,Jasmine Records
97239,Woody Herman and His Orchestra,2156676,1921847,New Orleans Original Film Soundtrack,7414,Jasmine Records
1617864,Original New Orleans Ragtime Band,2156676,1921847,New Orleans Original Film Soundtrack,7414,Jasmine Records
1743,Louis Armstrong,2269572,1948343,I Can't Give You Anything but Love / Dippermouth Blues,696,Brunswick
124272,Jimmy Dorsey & His Orchestra,2269572,1948343,I Can't Give You Anything but Love / Dippermouth Blues,696,Brunswick
33800,Duke Ellington & His Orchestra,3053624,2725620,The Mooche / Tight Like This,3071,Odeon
33800,Duke Ellington & His Orchestra,3053631,2725646,Dinah / Caravan,480,Parlophone
