id,name,credit,songid,song,labelid,label
508163,南波真理子,888149,620332,Azel: Panzer Dragoon RPG,3554,MMV
508163,南波真理子,888149,620332,Azel: Panzer Dragoon RPG,7551,長榮國際唱片有限公司
865524,長尾優進,2005454,1809504,Sonic Drift 2,-1,
529517,白津順子,1345143,1401309,Let’s Make a Pro J‐League Soccer Club! Original Sound Track,3554,MMV
775688,Jeremy B. Garren,1360404,1413624,Crimson Dragon,1985,Microsoft Corporation
185895,東祥高,2914599,2589290,Panzer Dragoon: Remake The Definitive Soundtrack,136053,Generation Series
185895,東祥高,2914599,2589290,Panzer Dragoon: Remake The Definitive Soundtrack,136053,Generation Series
865524,長尾優進,3033608,2707478,Sonic Drift 2,56261,SEGA
