id,name,credit,songid,song,labelid,label
959705,Marcus Pfister,1104486,1537567,Der Regenbogenfisch und die Glitzerschuppen,26128,EUROPA Mini
959705,Marcus Pfister,1684202,1311928,"Regenbogenfisch, komm, hilf mir!",28541,Menschenkinder
626937,Heiner Heusinger,1684202,1311928,"Regenbogenfisch, komm, hilf mir!",28541,Menschenkinder
626937,Heiner Heusinger,1715164,1698979,Die schönsten Tiergeschichten,-1,
626937,Heiner Heusinger,2382412,2124208,Detlev Jöcker präsentiert die schönsten Lach- und Spaßgeschichten,28541,Menschenkinder
1883092,Die Menschenkinder,2532236,1262268,Pop Fieber,28541,Menschenkinder
