id,name,credit,songid,song,labelid,label
1029419,Black Angel,1197886,1287595,Satan Is Power,40155,Stunde des Ideals Produktionen
1029419,Black Angel,1197886,1287595,Satan Is Power,51054,Total Death Records
748187,Redreom,1199367,998158,Pure Black Metal Holocaust,51054,Total Death Records
725225,Prosatanos,1199367,998158,Pure Black Metal Holocaust,51054,Total Death Records
387196,Heretic,1202465,1120362,Blasphemic Hymns For The Horned One,51054,Total Death Records
1206254,Dämonenblut,2886082,2558020,Des Teufels Mordgesindel,123619,Division Black Metal
323708,Akerbeltz,3104390,2772771,Slaughtered Whores of Satan,80314,Schattenkult Produktionen
1839713,Nebrus,3104390,2772771,Slaughtered Whores of Satan,80314,Schattenkult Produktionen
