id,name,credit,songid,song,labelid,label
360227,Alain Schneider,818196,892224,Rondes et comptines à chanter et à danser,41984,Milan jeunesse
360227,Alain Schneider,818196,933656,Comptines pour bien dormir,41984,Milan jeunesse
360227,Alain Schneider,818196,933657,Rondes et comptines des 4 saisons,41984,Milan jeunesse
360227,Alain Schneider,818196,1043779,Mon abécédaire en comptines,52706,Milan
360227,Alain Schneider,818196,1147084,Rondes et comptines des animaux,41984,Milan jeunesse
360227,Alain Schneider,818196,1605404,Contes et comptines pour la maternelle,41984,Milan jeunesse
360227,Alain Schneider,2650279,2337607,Rondes et comptines pour rire,-1,
