id,name,credit,songid,song,labelid,label
854410,Matty Valentino,1689569,2385348,Ich will ne Krankenschwester (Schwester Fester),195952,Watts Music
854410,Matty Valentino,1766684,2385347,Pistensau,81108,Hitmix Music
854410,Matty Valentino,1766684,2385352,Das kann kein Zufall sein,81108,Hitmix Music
854410,Matty Valentino,1766684,2385352,Das kann kein Zufall sein,81108,Hitmix Music
854410,Matty Valentino,2706717,2385386,Sha-La-Lie (Ich bin verliebt),81108,Hitmix Music
1522513,Isi Glück,2706723,2385392,Ich will zurück zu Dir,81108,Hitmix Music
