id,name,credit,songid,song,labelid,label
231463,John Harbison,2731694,2407611,World Premiere Recordings: Violin Concerto / Recordare / Seven Motets,4820,KOCH International Classics
1991474,Rose Mary Harbison,2731694,2407611,World Premiere Recordings: Violin Concerto / Recordare / Seven Motets,4820,KOCH International Classics
638752,The Orchestra and Chorus of Emmanuel Music,2731694,2407611,World Premiere Recordings: Violin Concerto / Recordare / Seven Motets,4820,KOCH International Classics
45914,Heinrich Schütz,2731731,2039292,Geistliche Chormusik 1648: The Six-Part Motets,4820,KOCH International Classics
1717984,The Chorus of Emmanuel Music,2731731,2039292,Geistliche Chormusik 1648: The Six-Part Motets,4820,KOCH International Classics
