id,name,credit,songid,song,labelid,label
1025589,Björn Granath,1192140,1284280,Hundraåringen som klev ut genom fönstret och försvann,-1,
341915,Otto Sander,1505895,1213785,"Der Hundertjährige, der aus dem Fenster stieg und verschwand",9934,Der Hörverlag
445727,Katharina Thalbach,1505904,1450348,"Die Analphabetin, die rechnen konnte",9934,Der Hörverlag
96230,Jürgen von der Lippe,1665450,1663608,Mörder Anders und seine Freunde nebst dem einen oder anderen Feind,9934,Der Hörverlag
160941,Dieter Hallervorden,2571565,2280670,"Der Hundertjährige, der zurückkam, um die Welt zu retten",9934,Der Hörverlag
1270082,Peter Weis,2957017,2638405,"Der Hundertjährige, der aus dem Fenster stieg und verschwand - Ungekürzte Lesung",9934,Der Hörverlag
