id,name,credit,songid,song,labelid,label
496734,New Zealand Symphony Orchestra,1420276,728529,The Three Symphonies,198,Naxos
496734,New Zealand Symphony Orchestra,1420276,2062266,A Song of Islands / Aotearoa Overture / Forest,198,Naxos
360682,James Judd,1420276,728529,The Three Symphonies,198,Naxos
360682,James Judd,1420276,2062266,A Song of Islands / Aotearoa Overture / Forest,198,Naxos
1102116,New Zealand String Quartet,1501990,1543333,String Quartet in E minor / Phantasy Quartet / Canzonettas / Duos for Two Violins / String Trio,198,Naxos
496734,New Zealand Symphony Orchestra,1609976,1458096,Aotearoa,93731,Kiwi Pacific
1048021,John Hopkins,1609976,1458096,Aotearoa,93731,Kiwi Pacific
1167018,Ithaca College Festival Orchestra,1609976,1458096,Aotearoa,93731,Kiwi Pacific
1167016,Grant Cooper,1609976,1458096,Aotearoa,93731,Kiwi Pacific
