id,name,credit,songid,song,labelid,label
2327,Johann Sebastian Bach,1559898,855171,Das Orgelwerk auf Silbermann-Orgeln Vol. III,10146,Berlin Classics
494697,Hans Otto,1559898,855171,Das Orgelwerk auf Silbermann-Orgeln Vol. III,10146,Berlin Classics
278831,Hannes Kästner,1559898,855171,Das Orgelwerk auf Silbermann-Orgeln Vol. III,10146,Berlin Classics
2327,Johann Sebastian Bach,1560636,855150,Das Orgelwerk auf Silbermannorgeln Vol. II,34782,Edel Classics
52652,Max Reger,2286001,2037645,Die großen Orgelwerke III,48395,Ars Vivendi
