id,name,credit,songid,song,labelid,label
624214,The MV/EE Medicine Show,871482,1032159,Redemption,53949,Heroine Celestial Agriculture
356975,Neil Campbell,1324222,1384989,Wharf Cat,92571,Golden Lab Records
152063,Oren Ambarchi,1510077,1548794,Live at TUSK Festival 2013,106730,TUSK
356975,Neil Campbell,1510077,1548794,Live at TUSK Festival 2013,106730,TUSK
145643,Sunburned Hand of the Man,2628653,2319483,Live Burn - Vol 1 - Ottawa 2007,9226,Manhand
624214,The MV/EE Medicine Show,2759732,2434621,I Left My Wallet in the Trossachs,53949,Heroine Celestial Agriculture
