id,name,credit,songid,song,labelid,label
628496,Blasphemophagher,1474310,927038,Triumph of Abominations,36942,Crush Until Madness Records
1135323,Godslaying Hellblast,2183179,1945638,Bestial Laceration Of Angelcunts,151380,Hate & Murder Productions
547573,Manticore,2445091,2182641,Receiving the Unholy Communion,29570,Iron Bonehead Productions
1946321,Satanik Goat Ritual,2650677,2337970,Rites of Black Blood,65819,Chalice of Blood Angel
553928,Deiphago,3089055,2759055,Gods of Holocaust,24278,Witchhammer Productions
