id,name,credit,songid,song,labelid,label
298340,Francisco Guerrero,1641336,628907,"Misa ""Puer Natus Est"" Canciones y Villanescas Espirituales",8073,Almaviva
598581,Josep Cabré,1641336,628907,"Misa ""Puer Natus Est"" Canciones y Villanescas Espirituales",8073,Almaviva
598581,Josep Cabré,1641337,810363,Salve Reyna: Música española,34007,Glissando
598580,Juan García de Salazar,2487427,1123780,Complete Vespers of Our Lady,198,Naxos
850740,Ministriles de Marsias,2487427,1123780,Complete Vespers of Our Lady,198,Naxos
598581,Josep Cabré,2487427,1123780,Complete Vespers of Our Lady,198,Naxos
