id,name,credit,songid,song,labelid,label
35232,New Found Glory,1037455,1187112,Not Without a Heart Once Nourished by Sticks and Stones Within Blood Ill-Tempered Misanthropy Pure Gold Can Stay,16549,Bridge Nine Records
6059,Another Victim,1308447,389484,A Whole New Level of Sickness,20470,Good Life Recordings
6059,Another Victim,1308447,389484,A Whole New Level of Sickness,20470,Good Life Recordings
6059,Another Victim,1308447,389484,A Whole New Level of Sickness,20470,Good Life Recordings
8167,Boysetsfire,1491781,321279,"Crush 'em All, Volume 1",16125,Undecided Records
5937,Indecision,2306540,105449,The Fall of Every Man,63522,Crisis Records
