id,name,credit,songid,song,labelid,label
765893,Ingo Siegner,1437646,1162623,Der kleine Drache Kokosnuss und der große Zauberer,29025,steinbach sprechende bücher
765893,Ingo Siegner,1437646,1548115,Der kleine Drache Kokosnuss (Teil 1),29025,steinbach sprechende bücher
765893,Ingo Siegner,1437646,1162629,Der kleine Drache Kokosnuss: Hab keine Angst,29025,steinbach sprechende bücher
765893,Ingo Siegner,1437646,1162631,Der kleine Drache Kokosnuss und der schwarze Ritter,29025,steinbach sprechende bücher
574861,François Lelord,1616017,779762,Hectors Reise,29025,steinbach sprechende bücher
39639,Henning Mankell,2258597,2010082,Der Chronist der Winde,9934,Der Hörverlag
39639,Henning Mankell,2258597,2010082,Der Chronist der Winde,109337,hr2-kultur
39639,Henning Mankell,2258597,2010228,Die rote Antilope,9934,Der Hörverlag
