id,name,credit,songid,song,labelid,label
55588,Soul Providers,963528,1149122,Gimme the Paw... And Eleven Other Funky Favourites,4880,P‐VINE RECORDS
55588,Soul Providers,963528,1149122,Gimme the Paw... And Eleven Other Funky Favourites,114269,Pure Records
379034,El Michels Affair,1692027,2635775,Never Be Another You,122340,Big Crown Records
1404953,Lee Fields & the Expressions,2446773,2596688,Big Crown Vaults Vol. 1,122340,Big Crown Records
1404953,Lee Fields & the Expressions,2446773,2596688,Big Crown Vaults Vol. 1,122340,Big Crown Records
